{
  "id": "el-alumno-invisible",
  "title": "El alumno invisible",
  "seed": 7,
  "description": "Marcos lleva dos meses sin encajar en el grupo. Las bromas, el silencio y la inercia colectiva deciden si la clase lo protege o lo abandona.",
  "intro": "Marcos es nuevo. En dos meses nadie le ha invitado a un grupo. Lo que hagas en estos diez días y lo que la clase haga marcará el desenlace. No hay respuestas correctas: cada decisión tiene un coste y consecuencias.",
  "prologue": [
    {
      "title": "Lunes, 8:20",
      "text": "Suena el timbre y entras en clase como cualquier otro día. Conoces cada cara: Daniel, que marca el ritmo del patio; Iván, que siempre encuentra la palabra exacta para hacer reír; Lucía, que habla poco pero se fija en todo; Sara, Pablo, Laura. La tuya es una clase normal. Como todas."
    },
    {
      "title": "Marcos",
      "text": "Marcos llegó hace dos meses, a mitad de curso. No venía con amigos ni con un grupo que le esperase. Los primeros días nadie le invitó a sentarse en el recreo; la gente le miraba de reojo y seguía con lo suyo. Poco a poco, dejó de sentarse con nadie."
    },
    {
      "title": "Tu papel",
      "text": "Tú no eres el cabecilla del grupo ni el que lo arregla todo. Eres uno más, con tus dudas y tu miedo a quedarte fuera. Lo que hagas —o no hagas— estos diez días no lo decide un guion: lo decide cómo se comporta el grupo a tu alrededor."
    },
    {
      "title": "Diez días",
      "text": "Van a pasar diez días de instituto. Cada día puede traer una situación y varias salidas. No hay respuestas correctas ni incorrectas: cada decisión tiene un coste, y la clase reacciona a lo que haces y a lo que no haces."
    },
    {
      "title": "No es un examen",
      "text": "No te van a puntuar. Nadie te dirá si has jugado bien o mal. Lo que sí ocurrirá: verás cómo se mueven el silencio, el apoyo, la presión y la norma en una clase real, y qué precio tienen las cosas. Empezamos."
    }
  ],
  "days": 10,
  "playerId": "tu",
  "victimId": "marcos",
  "initial": {
    "isolation": 55,
    "support": 20,
    "pressure": 40,
    "norm": 35,
    "silence": 50
  },
  "characters": [
    {
      "id": "marcos",
      "name": "Marcos",
      "role": "victim",
      "age": 15,
      "traits": {
        "empathy": 70,
        "popularity": 20,
        "influence": 15,
        "conformity": 75,
        "rejectionFear": 80
      },
      "beliefs": {
        "victimResponsibility": 50,
        "groupPressure": 60
      },
      "relationships": {
        "daniel": -40,
        "ivan": -30,
        "tu": 10
      }
    },
    {
      "id": "daniel",
      "name": "Daniel",
      "role": "aggressor",
      "age": 16,
      "traits": {
        "empathy": 25,
        "popularity": 90,
        "influence": 90,
        "conformity": 25,
        "rejectionFear": 20
      },
      "beliefs": {
        "victimResponsibility": 70,
        "groupPressure": 30
      },
      "relationships": {
        "marcos": -40,
        "ivan": 60,
        "lucia": 20
      }
    },
    {
      "id": "ivan",
      "name": "Iván",
      "role": "aggressor",
      "age": 16,
      "traits": {
        "empathy": 30,
        "popularity": 60,
        "influence": 55,
        "conformity": 70,
        "rejectionFear": 65
      },
      "beliefs": {
        "victimResponsibility": 60,
        "groupPressure": 70
      },
      "relationships": {
        "daniel": 60,
        "marcos": -25,
        "pablo": 20
      }
    },
    {
      "id": "lucia",
      "name": "Lucía",
      "role": "defender",
      "age": 15,
      "traits": {
        "empathy": 85,
        "popularity": 65,
        "influence": 55,
        "conformity": 40,
        "rejectionFear": 40
      },
      "beliefs": {
        "victimResponsibility": 30,
        "groupPressure": 35
      },
      "relationships": {
        "tu": 40,
        "sara": 30,
        "marcos": 20
      }
    },
    {
      "id": "sara",
      "name": "Sara",
      "role": "bystander",
      "age": 15,
      "traits": {
        "empathy": 60,
        "popularity": 45,
        "influence": 35,
        "conformity": 65,
        "rejectionFear": 60
      },
      "beliefs": {
        "victimResponsibility": 50,
        "groupPressure": 55
      },
      "relationships": {
        "lucia": 30,
        "pablo": 15
      }
    },
    {
      "id": "pablo",
      "name": "Pablo",
      "role": "bystander",
      "age": 15,
      "traits": {
        "empathy": 50,
        "popularity": 40,
        "influence": 30,
        "conformity": 80,
        "rejectionFear": 75
      },
      "beliefs": {
        "victimResponsibility": 45,
        "groupPressure": 70
      },
      "relationships": {
        "sara": 15,
        "ivan": 20
      }
    },
    {
      "id": "laura",
      "name": "Laura",
      "role": "neutral",
      "age": 16,
      "traits": {
        "empathy": 45,
        "popularity": 70,
        "influence": 60,
        "conformity": 55,
        "rejectionFear": 40
      },
      "beliefs": {
        "victimResponsibility": 40,
        "groupPressure": 45
      },
      "relationships": {
        "daniel": 35,
        "ivan": 20,
        "sara": 20
      }
    },
    {
      "id": "tu",
      "name": "Tú",
      "role": "neutral",
      "age": 15,
      "traits": {
        "empathy": 50,
        "popularity": 50,
        "influence": 45,
        "conformity": 50,
        "rejectionFear": 50
      },
      "beliefs": {
        "victimResponsibility": 50,
        "groupPressure": 50
      },
      "relationships": {
        "marcos": 10,
        "lucia": 40,
        "daniel": 20
      }
    }
  ],
  "events": [
    {
      "id": "primer-dia",
      "day": 1,
      "priority": 5,
      "condition": null,
      "actor": "laura",
      "speaker": "Laura (la delegada)",
      "scene": "El aula, primer recreo del trimestre. Las mesas forman islas y Marcos se sienta solo en una, junto a la ventana.",
      "text": "Marcos es nuevo. Ningún grupo le invita y hay sitio junto a él. Laura te mira, esperando que lo veas.",
      "choices": [
        {
          "id": "acoger",
          "text": "Te sientas con Marcos.",
          "stance": "pro",
          "consequence": "Marcos levanta la cabeza, sorprendido, y te dedica una sonrisa torpe. En la mesa, alguien deja de mirar el móvil. Por un momento, la isla deja de ser una isla.",
          "effects": {
            "support": 6,
            "isolation": -4,
            "silence": -2
          },
          "relationEffects": {
            "tu:marcos": 15
          },
          "setFlags": [],
          "clearFlags": []
        },
        {
          "id": "no_mirar",
          "text": "Miras hacia otra parte, como todos.",
          "stance": "anti",
          "consequence": "Nadie dice nada. La isla junto a la ventana sigue ahí, y tú también miras el móvil. Es fácil, y eso es justo lo que pesa.",
          "effects": {
            "support": -3,
            "silence": 4,
            "isolation": 2
          },
          "relationEffects": {},
          "setFlags": [],
          "clearFlags": []
        },
        {
          "id": "dejar",
          "text": "Dejas que lo organice Laura.",
          "stance": "neutral",
          "consequence": "Laura tampoco lo hace. El sitio junto a Marcos sigue vacío, y la clase entiende que, por ahora, nadie lo va a ocupar.",
          "effects": {
            "silence": 2,
            "isolation": 1
          },
          "relationEffects": {},
          "setFlags": [],
          "clearFlags": []
        }
      ]
    },
    {
      "id": "primera-broma",
      "day": 2,
      "priority": 5,
      "condition": null,
      "actor": "ivan",
      "speaker": "Iván",
      "scene": "En el pasillo, entre risas, Iván hace de anfitrión y varios miran de reojo para ver quién se ríe.",
      "text": "Algunos se ríen cuando Iván hace una broma sobre Marcos. 'Bienvenido al club, Marcitos.'",
      "choices": [
        {
          "id": "parar",
          "text": "'Dejadle en paz, no tiene gracia.'",
          "stance": "pro",
          "consequence": "La risa se corta un instante. Algunos se miran; Iván encoge los hombros como si nada, pero el chiste ya no tiene la misma gracia.",
          "effects": {
            "support": 7,
            "norm": 6,
            "silence": -4,
            "pressure": -3
          },
          "relationEffects": {
            "tu:marcos": 10
          },
          "setFlags": [
            "firmeza"
          ],
          "clearFlags": []
        },
        {
          "id": "reir",
          "text": "Te ríes para encajar.",
          "stance": "anti",
          "consequence": "Te ríes. Marcos baja la mirada y finge que no escucha. La risa os une a vosotros y le separa a él. Esa es la cuenta.",
          "effects": {
            "support": -4,
            "norm": -4,
            "silence": 5,
            "pressure": 3,
            "isolation": 4
          },
          "relationEffects": {},
          "setFlags": [],
          "clearFlags": []
        },
        {
          "id": "callar",
          "text": "Callas y miras el móvil.",
          "stance": "neutral",
          "consequence": "El silencio es tu respuesta. Nadie te señala, pero todos han visto que no has dicho nada.",
          "effects": {
            "silence": 3,
            "isolation": 2,
            "pressure": 1
          },
          "relationEffects": {},
          "setFlags": [],
          "clearFlags": []
        }
      ]
    },
    {
      "id": "pregunta-lucia",
      "day": 3,
      "priority": 4,
      "condition": {
        "variable": "silence",
        "op": ">",
        "value": 50
      },
      "actor": "lucia",
      "speaker": "Lucía se detiene",
      "scene": "El comedor bulle. Marcos come solo en la esquina y Lucía, a tu lado, no aparta la vista de él.",
      "text": "Nadie comenta lo de ayer. Marcos come solo. Lucía duda si pronunciarse.",
      "choices": [